[
  {
    "candidate_id": "syn-pair-a",
    "conformer_id": null,
    "metrics": [
      {
        "category": "declared_geometry",
        "context": "complex",
        "missing_reason": null,
        "name": "syn-pair:/distance_nm",
        "provenance": {
          "checkpoint_id": null,
          "model_id": "synthetic-geometry-report",
          "seed": 0
        },
        "raw_value": 3.0,
        "scale": null,
        "source": {
          "path": "/synthetic/producer-pair/pairs.json",
          "row": 7,
          "sha256": "bbbbbbbbbbbbbbbbbbbbbbbbbbbbbbbbbbbbbbbbbbbbbbbbbbbbbbbbbbbbbbbb"
        },
        "unit": "nm",
        "value": 3.0
      },
      {
        "category": "declared_span_composition",
        "context": "complex",
        "missing_reason": null,
        "name": "syn-pair:/segment_count",
        "provenance": {
          "checkpoint_id": null,
          "model_id": "synthetic-geometry-report",
          "seed": 0
        },
        "raw_value": 9.0,
        "scale": null,
        "source": {
          "path": "/synthetic/producer-pair/pairs.json",
          "row": 7,
          "sha256": "bbbbbbbbbbbbbbbbbbbbbbbbbbbbbbbbbbbbbbbbbbbbbbbbbbbbbbbbbbbbbbbb"
        },
        "unit": "dimensionless",
        "value": 9.0
      }
    ],
    "missing_values": {
      "conformer_id": "synthetic fixture",
      "sequence_hash": "synthetic fixture: no sequence is bound"
    },
    "provenance": {
      "checkpoint_id": null,
      "model_id": "synthetic-geometry-report",
      "seed": 0
    },
    "schema_version": "1.0",
    "sequence_hash": null,
    "target_id": "syn-target",
    "warnings": []
  },
  {
    "candidate_id": "syn-pair-b",
    "conformer_id": null,
    "metrics": [
      {
        "category": "declared_geometry",
        "context": "complex",
        "missing_reason": "upstream geometry report absent",
        "name": "syn-pair:/distance_nm",
        "provenance": {
          "checkpoint_id": null,
          "model_id": "synthetic-geometry-report",
          "seed": 0
        },
        "raw_value": null,
        "scale": null,
        "source": {
          "path": "/synthetic/producer-pair/pairs.json",
          "row": 7,
          "sha256": "bbbbbbbbbbbbbbbbbbbbbbbbbbbbbbbbbbbbbbbbbbbbbbbbbbbbbbbbbbbbbbbb"
        },
        "unit": "nm",
        "value": null
      },
      {
        "category": "declared_span_composition",
        "context": "complex",
        "missing_reason": null,
        "name": "syn-pair:/segment_count",
        "provenance": {
          "checkpoint_id": null,
          "model_id": "synthetic-geometry-report",
          "seed": 0
        },
        "raw_value": 9.0,
        "scale": null,
        "source": {
          "path": "/synthetic/producer-pair/pairs.json",
          "row": 7,
          "sha256": "bbbbbbbbbbbbbbbbbbbbbbbbbbbbbbbbbbbbbbbbbbbbbbbbbbbbbbbbbbbbbbbb"
        },
        "unit": "dimensionless",
        "value": 9.0
      }
    ],
    "missing_values": {
      "conformer_id": "synthetic fixture",
      "sequence_hash": "synthetic fixture: no sequence is bound"
    },
    "provenance": {
      "checkpoint_id": null,
      "model_id": "synthetic-geometry-report",
      "seed": 0
    },
    "schema_version": "1.0",
    "sequence_hash": null,
    "target_id": "syn-target",
    "warnings": []
  },
  {
    "candidate_id": "syn-pair-c",
    "conformer_id": null,
    "metrics": [
      {
        "category": "declared_span_composition",
        "context": "complex",
        "missing_reason": null,
        "name": "syn-pair:/segment_count",
        "provenance": {
          "checkpoint_id": null,
          "model_id": "synthetic-geometry-report",
          "seed": 0
        },
        "raw_value": 9.0,
        "scale": null,
        "source": {
          "path": "/synthetic/producer-pair/pairs.json",
          "row": 7,
          "sha256": "bbbbbbbbbbbbbbbbbbbbbbbbbbbbbbbbbbbbbbbbbbbbbbbbbbbbbbbbbbbbbbbb"
        },
        "unit": "dimensionless",
        "value": 9.0
      }
    ],
    "missing_values": {
      "conformer_id": "synthetic fixture",
      "sequence_hash": "synthetic fixture: no sequence is bound"
    },
    "provenance": {
      "checkpoint_id": null,
      "model_id": "synthetic-geometry-report",
      "seed": 0
    },
    "schema_version": "1.0",
    "sequence_hash": null,
    "target_id": "syn-target",
    "warnings": []
  },
  {
    "candidate_id": "syn-pair-d",
    "conformer_id": null,
    "metrics": [
      {
        "category": "declared_geometry",
        "context": "complex",
        "missing_reason": null,
        "name": "syn-pair:/distance_nm",
        "provenance": {
          "checkpoint_id": null,
          "model_id": "synthetic-geometry-report",
          "seed": 0
        },
        "raw_value": 0.0,
        "scale": null,
        "source": {
          "path": "/synthetic/producer-pair/pairs.json",
          "row": 7,
          "sha256": "bbbbbbbbbbbbbbbbbbbbbbbbbbbbbbbbbbbbbbbbbbbbbbbbbbbbbbbbbbbbbbbb"
        },
        "unit": "nm",
        "value": 0.0
      },
      {
        "category": "declared_span_composition",
        "context": "complex",
        "missing_reason": null,
        "name": "syn-pair:/segment_count",
        "provenance": {
          "checkpoint_id": null,
          "model_id": "synthetic-geometry-report",
          "seed": 0
        },
        "raw_value": 1.0,
        "scale": null,
        "source": {
          "path": "/synthetic/producer-pair/pairs.json",
          "row": 7,
          "sha256": "bbbbbbbbbbbbbbbbbbbbbbbbbbbbbbbbbbbbbbbbbbbbbbbbbbbbbbbbbbbbbbbb"
        },
        "unit": "dimensionless",
        "value": 1.0
      }
    ],
    "missing_values": {
      "conformer_id": "synthetic fixture",
      "sequence_hash": "synthetic fixture: no sequence is bound"
    },
    "provenance": {
      "checkpoint_id": null,
      "model_id": "synthetic-geometry-report",
      "seed": 0
    },
    "schema_version": "1.0",
    "sequence_hash": null,
    "target_id": "syn-target",
    "warnings": []
  },
  {
    "candidate_id": "syn-pair-e",
    "conformer_id": null,
    "metrics": [
      {
        "category": "declared_geometry",
        "context": "complex",
        "missing_reason": null,
        "name": "syn-pair:/distance_nm",
        "provenance": {
          "checkpoint_id": null,
          "model_id": "synthetic-geometry-report",
          "seed": 0
        },
        "raw_value": -1.5,
        "scale": null,
        "source": {
          "path": "/synthetic/producer-pair/pairs.json",
          "row": 7,
          "sha256": "bbbbbbbbbbbbbbbbbbbbbbbbbbbbbbbbbbbbbbbbbbbbbbbbbbbbbbbbbbbbbbbb"
        },
        "unit": "nm",
        "value": -1.5
      },
      {
        "category": "declared_span_composition",
        "context": "complex",
        "missing_reason": null,
        "name": "syn-pair:/segment_count",
        "provenance": {
          "checkpoint_id": null,
          "model_id": "synthetic-geometry-report",
          "seed": 0
        },
        "raw_value": 9.0,
        "scale": null,
        "source": {
          "path": "/synthetic/producer-pair/pairs.json",
          "row": 7,
          "sha256": "bbbbbbbbbbbbbbbbbbbbbbbbbbbbbbbbbbbbbbbbbbbbbbbbbbbbbbbbbbbbbbbb"
        },
        "unit": "dimensionless",
        "value": 9.0
      }
    ],
    "missing_values": {
      "conformer_id": "synthetic fixture",
      "sequence_hash": "synthetic fixture: no sequence is bound"
    },
    "provenance": {
      "checkpoint_id": null,
      "model_id": "synthetic-geometry-report",
      "seed": 0
    },
    "schema_version": "1.0",
    "sequence_hash": null,
    "target_id": "syn-target",
    "warnings": []
  },
  {
    "candidate_id": "syn-pair-f",
    "conformer_id": null,
    "metrics": [
      {
        "category": "declared_geometry",
        "context": "complex",
        "missing_reason": null,
        "name": "syn-pair:/distance_nm",
        "provenance": {
          "checkpoint_id": null,
          "model_id": "synthetic-geometry-report",
          "seed": 0
        },
        "raw_value": 3,
        "scale": null,
        "source": {
          "path": "/synthetic/producer-pair/pairs.json",
          "row": 7,
          "sha256": "bbbbbbbbbbbbbbbbbbbbbbbbbbbbbbbbbbbbbbbbbbbbbbbbbbbbbbbbbbbbbbbb"
        },
        "unit": "nm",
        "value": 3
      },
      {
        "category": "declared_span_composition",
        "context": "complex",
        "missing_reason": null,
        "name": "syn-pair:/segment_count",
        "provenance": {
          "checkpoint_id": null,
          "model_id": "synthetic-geometry-report",
          "seed": 0
        },
        "raw_value": 9007199254740993,
        "scale": null,
        "source": {
          "path": "/synthetic/producer-pair/pairs.json",
          "row": 7,
          "sha256": "bbbbbbbbbbbbbbbbbbbbbbbbbbbbbbbbbbbbbbbbbbbbbbbbbbbbbbbbbbbbbbbb"
        },
        "unit": "dimensionless",
        "value": 9007199254740993
      }
    ],
    "missing_values": {
      "conformer_id": "synthetic fixture",
      "sequence_hash": "synthetic fixture: no sequence is bound"
    },
    "provenance": {
      "checkpoint_id": null,
      "model_id": "synthetic-geometry-report",
      "seed": 0
    },
    "schema_version": "1.0",
    "sequence_hash": null,
    "target_id": "syn-target",
    "warnings": []
  }
]
